{
  "artifacts": [
    {
      "executable": true,
      "path": "bin/efis-blackbox-broker",
      "sha256": "ca561638c571ea0131c3d9a11ffb197e5aa781db1910ee6d444f367c91089c54"
    }
  ],
  "built_utc": "2026-09-20T05:57:54Z",
  "flight_approval": false,
  "platform": "RPI5_AARCH64",
  "release_id": "blackbox-7655799-primary-v1",
  "repository": "sfuso68/efis-next-professional",
  "roles": [
    "BLACKBOX"
  ],
  "schema": "efis-next.release-manifest.v1",
  "simulation_mode": true,
  "source_commit": "765579959f7970a17eb212ca1ef13628aaa4d71f"
}
